{
  "schema": "verification-manifest.schema.json#v1",
  "spec": "auth-guest",
  "run_id": "2026-07-23T20-24-45-535Z",
  "project": "Desktop Chrome",
  "target": "preprod",
  "base_url": "https://main.d29tlmksqcx494.amplifyapp.com",
  "started_at": "2026-07-23T20:24:46.152Z",
  "steps": [
    {
      "n": 1,
      "name": "landing",
      "file": "auth-guest-01-landing.png",
      "expected_ui_state": "Header UserMenu shows Guest; anonymous 201 in auth log",
      "page_url": "https://main.d29tlmksqcx494.amplifyapp.com/",
      "main_status": 200,
      "auth_requests": [
        {
          "method": "POST",
          "path": "/api/v2/auth/refresh",
          "status": 401
        },
        {
          "method": "POST",
          "path": "/api/v2/auth/anonymous",
          "status": 201
        }
      ],
      "api_errors": [],
      "console_errors": [
        "Failed to load resource: the server responded with a status of 401 ()"
      ],
      "page_errors": [],
      "dom_probe": {
        "selector": "[data-testid=\"user-menu-trigger\"]",
        "present": true,
        "text": "Guest",
        "expect_text": "Guest",
        "text_match": true
      },
      "timestamp": "2026-07-23T20:24:49.711Z",
      "test_location": "tests/e2e/auth-guest.spec.ts:18",
      "interception_at_capture": false
    },
    {
      "n": 2,
      "name": "menu-open",
      "file": "auth-guest-02-menu-open.png",
      "expected_ui_state": "Open user menu: Guest identity + anonymous \"Sign in with email\" upsell (session chip lives in the header)",
      "page_url": "https://main.d29tlmksqcx494.amplifyapp.com/",
      "main_status": 200,
      "auth_requests": [],
      "api_errors": [],
      "console_errors": [],
      "page_errors": [],
      "dom_probe": {
        "selector": "text=Sign in with email",
        "present": true,
        "text": "Sign in with email"
      },
      "timestamp": "2026-07-23T20:24:50.228Z",
      "test_location": "tests/e2e/auth-guest.spec.ts:18",
      "interception_at_capture": false
    },
    {
      "n": 3,
      "name": "post-reload",
      "file": "auth-guest-03-post-reload.png",
      "expected_ui_state": "Still Guest after F5; refresh 200 in auth log; no second anonymous 201",
      "page_url": "https://main.d29tlmksqcx494.amplifyapp.com/",
      "main_status": 200,
      "auth_requests": [
        {
          "method": "POST",
          "path": "/api/v2/auth/refresh",
          "status": 200
        }
      ],
      "api_errors": [],
      "console_errors": [],
      "page_errors": [],
      "dom_probe": {
        "selector": "[data-testid=\"user-menu-trigger\"]",
        "present": true,
        "text": "Guest",
        "expect_text": "Guest",
        "text_match": true
      },
      "timestamp": "2026-07-23T20:24:51.418Z",
      "test_location": "tests/e2e/auth-guest.spec.ts:18",
      "interception_at_capture": false
    },
    {
      "n": 4,
      "name": "alerts-redirect",
      "file": "auth-guest-04-alerts-redirect.png",
      "expected_ui_state": "Guest redirected off /alerts to signin; page_url has redirect=%2Falerts and upgrade=true",
      "page_url": "https://main.d29tlmksqcx494.amplifyapp.com/auth/signin?redirect=%2Falerts&upgrade=true",
      "main_status": 200,
      "auth_requests": [
        {
          "method": "POST",
          "path": "/api/v2/auth/refresh",
          "status": 200
        },
        {
          "method": "GET",
          "path": "/api/v2/auth/oauth/urls",
          "status": 200
        }
      ],
      "api_errors": [],
      "console_errors": [],
      "page_errors": [],
      "dom_probe": {
        "selector": "[data-testid=\"signin-heading\"]",
        "present": true,
        "text": "Welcome back"
      },
      "timestamp": "2026-07-23T20:24:53.082Z",
      "test_location": "tests/e2e/auth-guest.spec.ts:18",
      "interception_at_capture": false
    }
  ],
  "forbidden_requests": [
    {
      "method": "POST",
      "path": "/api/v2/auth/anonymous",
      "status": 201,
      "max_count": 1,
      "observed_count": 1,
      "pass": true
    }
  ],
  "interception": {
    "route_registrations": 0,
    "clean": true
  },
  "finished_at": "2026-07-23T20:24:53.123Z"
}
